{
  "evidence_as_of": "2026-08-27",
  "instruments": [
    {
      "asset_type": "stock",
      "benchmark_id": "TW:BROAD_MARKET",
      "evidence": [
        {
          "claims": [
            "identity",
            "listing",
            "currency",
            "asset_type",
            "live_age",
            "liquidity",
            "themes",
            "selection_rationale"
          ],
          "observed_at": "2026-08-27",
          "publication_use": "metadata_link_only",
          "source_id": "TWSE_OGL_COMPANY",
          "url": "https://www.tsmc.com/english/aboutTSMC/company_profile"
        }
      ],
      "exchange": "TWSE",
      "history": {
        "basis": "官方上市／基金頁面與交易所 reference metadata。",
        "live_age_status": "sufficient",
        "note": "年齡判定不代表資料供應商可提供同長度的 point-in-time 歷史。",
        "start_date": null,
        "usable_history_note": "需完成授權、覆蓋期間與 point-in-time 欄位驗證；目前不可供模型使用。",
        "usable_history_status": "conditional"
      },
      "instrument_id": "TW:STOCK:2330",
      "legal_name": "Taiwan Semiconductor Manufacturing Company Limited",
      "liquidity": {
        "note": "已確認仍在交易；成交額、價差與容量門檻需由獲授權資料量化。",
        "status": "quantitative_review_pending"
      },
      "listing_status": "active",
      "models": {
        "cobweb_supply_demand": {
          "reason": "待 point-in-time 資料、回測與 owner 核准後才可適用。",
          "status": "conditional"
        },
        "etf_look_through": {
          "reason": "此模型不適用此資產類型或目前研究問題。",
          "status": "not_applicable"
        },
        "h_model": {
          "reason": "待 point-in-time 資料、回測與 owner 核准後才可適用。",
          "status": "conditional"
        },
        "reverse_dcf": {
          "reason": "待 point-in-time 資料、回測與 owner 核准後才可適用。",
          "status": "conditional"
        }
      },
      "official_url": "https://www.tsmc.com/english/aboutTSMC/company_profile",
      "replacement_assessment": "retain_for_owner_review",
      "review_flags": [
        "LIQUIDITY_THRESHOLD_PENDING",
        "OWNER_APPROVAL_REQUIRED"
      ],
      "selection_rationale": "大型半導體製造候選；需確認資料授權、流動性與主題集中度。",
      "symbol": "2330",
      "theme_evidence": [
        "ai",
        "semiconductor"
      ],
      "trading_currency": "TWD",
      "verification_status": "verified_after_correction"
    },
    {
      "asset_type": "stock",
      "benchmark_id": "TW:BROAD_MARKET",
      "evidence": [
        {
          "claims": [
            "identity",
            "listing",
            "currency",
            "asset_type",
            "live_age",
            "liquidity",
            "themes",
            "selection_rationale"
          ],
          "observed_at": "2026-08-27",
          "publication_use": "metadata_link_only",
          "source_id": "TWSE_OGL_COMPANY",
          "url": "https://corp.mediatek.com/about"
        }
      ],
      "exchange": "TWSE",
      "history": {
        "basis": "官方上市／基金頁面與交易所 reference metadata。",
        "live_age_status": "sufficient",
        "note": "年齡判定不代表資料供應商可提供同長度的 point-in-time 歷史。",
        "start_date": null,
        "usable_history_note": "需完成授權、覆蓋期間與 point-in-time 欄位驗證；目前不可供模型使用。",
        "usable_history_status": "conditional"
      },
      "instrument_id": "TW:STOCK:2454",
      "legal_name": "MediaTek Inc.",
      "liquidity": {
        "note": "已確認仍在交易；成交額、價差與容量門檻需由獲授權資料量化。",
        "status": "quantitative_review_pending"
      },
      "listing_status": "active",
      "models": {
        "cobweb_supply_demand": {
          "reason": "待 point-in-time 資料、回測與 owner 核准後才可適用。",
          "status": "conditional"
        },
        "etf_look_through": {
          "reason": "此模型不適用此資產類型或目前研究問題。",
          "status": "not_applicable"
        },
        "h_model": {
          "reason": "待 point-in-time 資料、回測與 owner 核准後才可適用。",
          "status": "conditional"
        },
        "reverse_dcf": {
          "reason": "待 point-in-time 資料、回測與 owner 核准後才可適用。",
          "status": "conditional"
        }
      },
      "official_url": "https://corp.mediatek.com/about",
      "replacement_assessment": "retain_for_owner_review",
      "review_flags": [
        "LIQUIDITY_THRESHOLD_PENDING",
        "OWNER_APPROVAL_REQUIRED"
      ],
      "selection_rationale": "IC 設計候選；需驗證財報與產業循環資料可得性。",
      "symbol": "2454",
      "theme_evidence": [
        "ai",
        "semiconductor"
      ],
      "trading_currency": "TWD",
      "verification_status": "verified"
    },
    {
      "asset_type": "stock",
      "benchmark_id": "TW:BROAD_MARKET",
      "evidence": [
        {
          "claims": [
            "identity",
            "listing",
            "currency",
            "asset_type",
            "live_age",
            "liquidity",
            "themes",
            "selection_rationale"
          ],
          "observed_at": "2026-08-27",
          "publication_use": "metadata_link_only",
          "source_id": "TWSE_OGL_COMPANY",
          "url": "https://www.deltaww.com/en-US/about/aboutDelta"
        }
      ],
      "exchange": "TWSE",
      "history": {
        "basis": "官方上市／基金頁面與交易所 reference metadata。",
        "live_age_status": "sufficient",
        "note": "年齡判定不代表資料供應商可提供同長度的 point-in-time 歷史。",
        "start_date": null,
        "usable_history_note": "需完成授權、覆蓋期間與 point-in-time 欄位驗證；目前不可供模型使用。",
        "usable_history_status": "conditional"
      },
      "instrument_id": "TW:STOCK:2308",
      "legal_name": "Delta Electronics, Inc.",
      "liquidity": {
        "note": "已確認仍在交易；成交額、價差與容量門檻需由獲授權資料量化。",
        "status": "quantitative_review_pending"
      },
      "listing_status": "active",
      "models": {
        "cobweb_supply_demand": {
          "reason": "此模型不適用此資產類型或目前研究問題。",
          "status": "not_applicable"
        },
        "etf_look_through": {
          "reason": "此模型不適用此資產類型或目前研究問題。",
          "status": "not_applicable"
        },
        "h_model": {
          "reason": "待 point-in-time 資料、回測與 owner 核准後才可適用。",
          "status": "conditional"
        },
        "reverse_dcf": {
          "reason": "待 point-in-time 資料、回測與 owner 核准後才可適用。",
          "status": "conditional"
        }
      },
      "official_url": "https://www.deltaww.com/en-US/about/aboutDelta",
      "replacement_assessment": "retain_for_owner_review",
      "review_flags": [
        "LIQUIDITY_THRESHOLD_PENDING",
        "OWNER_APPROVAL_REQUIRED"
      ],
      "selection_rationale": "電源與基礎設施候選；需評估主題曝險與來源完整性。",
      "symbol": "2308",
      "theme_evidence": [
        "ai_infrastructure"
      ],
      "trading_currency": "TWD",
      "verification_status": "verified"
    },
    {
      "asset_type": "stock",
      "benchmark_id": "TW:BROAD_MARKET",
      "evidence": [
        {
          "claims": [
            "identity",
            "listing",
            "currency",
            "asset_type",
            "live_age",
            "liquidity",
            "themes",
            "selection_rationale"
          ],
          "observed_at": "2026-08-27",
          "publication_use": "metadata_link_only",
          "source_id": "TWSE_OGL_COMPANY",
          "url": "https://www.cht.com.tw/en/home/cht/about-cht/company-profile"
        }
      ],
      "exchange": "TWSE",
      "history": {
        "basis": "官方上市／基金頁面與交易所 reference metadata。",
        "live_age_status": "sufficient",
        "note": "年齡判定不代表資料供應商可提供同長度的 point-in-time 歷史。",
        "start_date": null,
        "usable_history_note": "需完成授權、覆蓋期間與 point-in-time 欄位驗證；目前不可供模型使用。",
        "usable_history_status": "conditional"
      },
      "instrument_id": "TW:STOCK:2412",
      "legal_name": "Chunghwa Telecom Co., Ltd.",
      "liquidity": {
        "note": "已確認仍在交易；成交額、價差與容量門檻需由獲授權資料量化。",
        "status": "quantitative_review_pending"
      },
      "listing_status": "active",
      "models": {
        "cobweb_supply_demand": {
          "reason": "此模型不適用此資產類型或目前研究問題。",
          "status": "not_applicable"
        },
        "etf_look_through": {
          "reason": "此模型不適用此資產類型或目前研究問題。",
          "status": "not_applicable"
        },
        "h_model": {
          "reason": "待 point-in-time 資料、回測與 owner 核准後才可適用。",
          "status": "conditional"
        },
        "reverse_dcf": {
          "reason": "待 point-in-time 資料、回測與 owner 核准後才可適用。",
          "status": "conditional"
        }
      },
      "official_url": "https://www.cht.com.tw/en/home/cht/about-cht/company-profile",
      "replacement_assessment": "retain_for_owner_review",
      "review_flags": [
        "LIQUIDITY_THRESHOLD_PENDING",
        "OWNER_APPROVAL_REQUIRED"
      ],
      "selection_rationale": "電信與股息候選；需確認股利與估值資料的 point-in-time 可得性。",
      "symbol": "2412",
      "theme_evidence": [
        "telecom",
        "dividend"
      ],
      "trading_currency": "TWD",
      "verification_status": "verified"
    },
    {
      "asset_type": "stock",
      "benchmark_id": "TW:BROAD_MARKET",
      "evidence": [
        {
          "claims": [
            "identity",
            "listing",
            "currency",
            "asset_type",
            "live_age",
            "liquidity",
            "themes",
            "selection_rationale"
          ],
          "observed_at": "2026-08-27",
          "publication_use": "metadata_link_only",
          "source_id": "TWSE_OGL_COMPANY",
          "url": "https://www.ctbcholding.com/en/en_abo_intro.html"
        }
      ],
      "exchange": "TWSE",
      "history": {
        "basis": "官方上市／基金頁面與交易所 reference metadata。",
        "live_age_status": "sufficient",
        "note": "年齡判定不代表資料供應商可提供同長度的 point-in-time 歷史。",
        "start_date": null,
        "usable_history_note": "需完成授權、覆蓋期間與 point-in-time 欄位驗證；目前不可供模型使用。",
        "usable_history_status": "conditional"
      },
      "instrument_id": "TW:STOCK:2891",
      "legal_name": "CTBC Financial Holding Co., Ltd.",
      "liquidity": {
        "note": "已確認仍在交易；成交額、價差與容量門檻需由獲授權資料量化。",
        "status": "quantitative_review_pending"
      },
      "listing_status": "active",